{
  "id": "sys",
  "version": "1.0.0",
  "name": {"es": "Sistema", "en": "System"},
  "settings": {"version": 1, "fields": [
    {"key": "lang", "type": "select", "default": "es",
     "group": {"es": "Placa", "en": "Board"},
     "label": {"es": "Idioma de la placa", "en": "Board language"},
     "options": [{"v": "es", "es": "Español", "en": "Español"},
                 {"v": "en", "es": "English", "en": "English"}]},
    {"key": "theme", "type": "select", "default": "night",
     "group": {"es": "Placa", "en": "Board"},
     "label": {"es": "Tema", "en": "Theme"},
     "help": {"es": "«Según el sol» sigue el día y la noche de tu ciudad, con el dato del tiempo.",
              "en": "«By the sun» follows day and night in your city, using the weather data."},
     "options": [{"v": "day", "es": "Día", "en": "Day"},
                 {"v": "night", "es": "Noche", "en": "Night"},
                 {"v": "auto", "es": "Según el sol", "en": "By the sun"}]},
    {"key": "loc", "type": "location",
     "group": {"es": "Hora y tiempo", "en": "Time and weather"},
     "label": {"es": "Ciudad", "en": "City"},
     "help": {"es": "La del tiempo de la cabecera. Al elegirla se pone también su zona horaria.",
              "en": "Used for the weather in the header. Picking it also sets its time zone."}},
    {"key": "tz", "type": "tz", "default": {"iana": "Europe/Madrid", "posix": "CET-1CEST,M3.5.0,M10.5.0/3"},
     "group": {"es": "Hora y tiempo", "en": "Time and weather"},
     "label": {"es": "Zona horaria", "en": "Time zone"},
     "help": {"es": "Cámbiala solo si la placa está en otra zona que la ciudad.",
              "en": "Only change it if the board is in a different zone from the city."}},
    {"key": "ntp", "type": "host", "scope": "any",
     "group": {"es": "Hora y tiempo", "en": "Time and weather"},
     "label": {"es": "Servidor de hora propio", "en": "Own time server"},
     "help": {"es": "Opcional. Vacío: el del router y los de Internet.",
              "en": "Optional. Empty: the router's and the Internet ones."}},
    {"key": "idle", "type": "number", "min": 0, "max": 240, "step": 5, "default": 10, "unit": "min",
     "group": {"es": "Reposo", "en": "Idle"},
     "label": {"es": "Reposo tras", "en": "Idle after"},
     "help": {"es": "Sin tocar la pantalla. Con 0 no entra nunca sola.",
              "en": "Without touching the screen. With 0 it never goes idle by itself."}},
    {"key": "idle_by", "type": "select", "options_from": "system.idle", "default": "auto",
     "group": {"es": "Reposo", "en": "Idle"},
     "label": {"es": "Qué sale en reposo", "en": "What shows while idle"},
     "help": {"es": "Automático: tu salvapantallas si tienes uno activo; si no, el reloj.",
              "en": "Automatic: your screensaver if one is on; otherwise the clock."}},
    {"key": "night", "type": "bool", "default": false,
     "group": {"es": "Reposo", "en": "Idle"},
     "label": {"es": "Reposo por la noche", "en": "Idle at night"}},
    {"key": "night_from", "type": "time", "default": "23:30", "visible_if": {"night": true},
     "group": {"es": "Reposo", "en": "Idle"},
     "label": {"es": "Desde", "en": "From"}},
    {"key": "night_to", "type": "time", "default": "07:00", "visible_if": {"night": true},
     "group": {"es": "Reposo", "en": "Idle"},
     "label": {"es": "Hasta", "en": "Until"}},
    {"key": "live_idle", "type": "bool", "default": true,
     "group": {"es": "Reposo", "en": "Idle"},
     "label": {"es": "Cuentas en marcha en el reposo", "en": "Running counters while idle"},
     "help": {"es": "Por ejemplo, la cuenta atrás del Pomodoro debajo del reloj.",
              "en": "For example, the Pomodoro countdown under the clock."}},
    {"key": "home", "type": "select", "options_from": "system.pages", "default": "pauta",
     "group": {"es": "Inicio", "en": "Home"},
     "label": {"es": "Página de inicio", "en": "Home page"}},
    {"key": "home_min", "type": "number", "min": 0, "max": 60, "default": 3, "unit": "min",
     "group": {"es": "Inicio", "en": "Home"},
     "label": {"es": "Volver al inicio tras", "en": "Back home after"},
     "help": {"es": "Sin tocar la pantalla. Con 0 no vuelve nunca.",
              "en": "Without touching the screen. With 0 it never goes back."}},
    {"key": "pin", "type": "secret", "max": 8, "pattern": "^[0-9]{4,8}$", "confirm": true,
     "ack": {"es": "Si olvidas el PIN y no has activado «Desbloquear desde Telegram», la única forma de recuperar la placa es borrarla entera por USB, y se pierde todo, también la lista.",
             "en": "If you forget the PIN and have not turned on «Unlock from Telegram», the only way back is to erase the whole board over USB, and everything is lost, the list too."},
     "group": {"es": "Bloqueo con PIN", "en": "PIN lock"},
     "label": {"es": "PIN", "en": "PIN"},
     "help": {"es": "De 4 a 8 cifras. Si lo olvidas y no activas «Desbloquear desde Telegram», solo queda borrar la placa entera por USB.",
              "en": "4 to 8 digits. If you forget it and did not turn on «Unlock from Telegram», the only way out is to erase the whole board over USB."}},
    {"key": "lock_min", "type": "number", "min": 0, "max": 240, "step": 5, "default": 0, "unit": "min",
     "group": {"es": "Bloqueo con PIN", "en": "PIN lock"},
     "label": {"es": "Bloquear tras", "en": "Lock after"},
     "help": {"es": "Sin usarla. Con 0, solo a mano: mantén pulsado el reloj.",
              "en": "Without use. With 0, only by hand: hold the clock."}},
    {"key": "lock_sched", "type": "bool", "default": false,
     "group": {"es": "Bloqueo con PIN", "en": "PIN lock"},
     "label": {"es": "Bloquear por horario", "en": "Lock on a schedule"}},
    {"key": "lock_from", "type": "time", "default": "19:00", "visible_if": {"lock_sched": true},
     "group": {"es": "Bloqueo con PIN", "en": "PIN lock"},
     "label": {"es": "Desde", "en": "From"}},
    {"key": "lock_to", "type": "time", "default": "08:00", "visible_if": {"lock_sched": true},
     "group": {"es": "Bloqueo con PIN", "en": "PIN lock"},
     "label": {"es": "Hasta", "en": "Until"}},
    {"key": "lock_show", "type": "select", "default": "idle",
     "group": {"es": "Bloqueo con PIN", "en": "PIN lock"},
     "label": {"es": "Con la pantalla bloqueada, enseñar", "en": "While locked, show"},
     "options": [{"v": "idle", "es": "El reposo (fotos incluidas)", "en": "Idle mode (photos included)"},
                 {"v": "clock", "es": "Solo el reloj", "en": "Only the clock"}]},
    {"key": "live_lock", "type": "bool", "default": true,
     "group": {"es": "Bloqueo con PIN", "en": "PIN lock"},
     "label": {"es": "Cuentas en marcha con la pantalla bloqueada", "en": "Running counters while locked"}},
    {"key": "unlock_tg", "type": "bool", "default": false, "confirm": true,
     "group": {"es": "Bloqueo con PIN", "en": "PIN lock"},
     "label": {"es": "Desbloquear desde Telegram con /unlock", "en": "Unlock from Telegram with /unlock"},
     "help": {"es": "Encenderlo se confirma en la pantalla. Quien entre en tu Telegram también podría desbloquearla.",
              "en": "Turning it on is confirmed on the screen. Anyone who gets into your Telegram could unlock it too."}},
    {"key": "photos", "type": "select", "options_from": "system.photos", "default": "auto",
     "group": {"es": "Fotos", "en": "Photos"},
     "label": {"es": "Fotos que mandas al bot", "en": "Photos you send to the bot"},
     "help": {"es": "Qué plugin se las queda. Automático: el único activo que recibe fotos. Con un comando en el pie, van a ese plugin.",
              "en": "Which plugin keeps them. Automatic: the only active one that takes photos. With a command in the caption, they go to that plugin."}},
    {"key": "kb", "type": "select", "default": "es",
     "group": {"es": "Teclado del ordenador", "en": "Computer keyboard"},
     "label": {"es": "Distribución", "en": "Layout"},
     "help": {"es": "La del ordenador al que se conecta Atajos, para que los textos salgan bien.",
              "en": "That of the computer Shortcuts plugs into, so typed text comes out right."},
     "options": [{"v": "es", "es": "Español (Windows y Linux)", "en": "Spanish (Windows and Linux)"},
                 {"v": "es-mac", "es": "Español (Mac)", "en": "Spanish (Mac)"},
                 {"v": "us", "es": "Inglés (EE. UU.)", "en": "English (US)"}]},
    {"key": "kb_speed", "type": "select", "default": "20",
     "group": {"es": "Teclado del ordenador", "en": "Computer keyboard"},
     "label": {"es": "Velocidad al escribir", "en": "Typing speed"},
     "help": {"es": "Baja la velocidad si un escritorio remoto se come letras.",
              "en": "Lower it if a remote desktop drops letters."},
     "options": [{"v": "50", "es": "Rápida (50 teclas/s)", "en": "Fast (50 keys/s)"},
                 {"v": "20", "es": "Normal (20 teclas/s)", "en": "Normal (20 keys/s)"},
                 {"v": "10", "es": "Lenta (10 teclas/s)", "en": "Slow (10 keys/s)"}]}
  ]}
}
